{
  "$schema": "../schemas/cloud-agent-config.json",
  "name": "DebtScanner",
  "description": "Monthly technical debt scanner that identifies code smells, TODOs, and improvement opportunities",
  "claudeAgentId": "check-code-debt",
  "claudeAgentPath": ".claude/agents/check-code-debt.md",
  "trigger": {
    "type": "schedule",
    "schedule": "0 10 1 * *",
    "timezone": "UTC",
    "description": "Runs on the 1st of each month at 10:00 AM UTC"
  },
  "model": "claude-sonnet-4",
  "prompt": {
    "template": "Scan the codebase for technical debt and improvement opportunities:\n- TODO/FIXME/HACK comments\n- Code duplication\n- Complex functions (high cyclomatic complexity)\n- Outdated dependencies\n- Missing tests\n- Poor error handling\n\nGenerate a prioritized technical debt report with recommendations.",
    "context": {
      "excludePaths": [
        "node_modules/",
        "dist/",
        "build/",
        ".git/",
        "coverage/"
      ],
      "focusAreas": [
        "src/",
        "scripts/",
        ".claude/"
      ]
    }
  },
  "output": {
    "format": "issue",
    "labels": ["technical-debt", "maintenance"],
    "assignees": [],
    "template": "technical-debt-report"
  },
  "metadata": {
    "category": "code-quality",
    "priority": "low",
    "estimatedDuration": "10-15 minutes",
    "requiredTools": ["Read", "Grep", "Glob", "Bash"]
  }
}
